{
  "id":"panelcontainer-94f9ea9e7d",
  "constraintMessages": {
    "accept": "There is an error in the field",
    "enforceEnum": "There is an error in the field",
    "maxFileSize": "There is an error in the field",
    "maxItems": "There is an error in the field",
    "minItems": "There is an error in the field",
    "required": "There is an error in the field",
    "step": "There is an error in the field",
    "type": "There is an error in the field",
    "uniqueItems": "There is an error in the field",
    "validationExpression": "There is an error in the field"
  },
  "description":"dependent names description",
  "tooltip":"dependent names tooltip",
  "fieldType":"panel",
  "name":"abc",
  "visible":true,
  "enabled":true,
  "items":[
    {
      "id":"textinput-6c994d85b4",
      "constraintMessages": {
        "accept": "There is an error in the field",
        "enforceEnum": "There is an error in the field",
        "format": "There is an error in the field",
        "maxFileSize": "There is an error in the field",
        "maxItems": "There is an error in the field",
        "maxLength": "There is an error in the field",
        "minItems": "There is an error in the field",
        "minLength": "There is an error in the field",
        "pattern": "There is an error in the field",
        "required": "There is an error in the field",
        "step": "There is an error in the field",
        "type": "There is an error in the field",
        "uniqueItems": "There is an error in the field",
        "validationExpression": "There is an error in the field"
      },
      "description":"dummy",
      "type":"string",
      "fieldType":"text-input",
      "required":false,
      "name":"abc",
      "visible":false,
      "enabled":true,
      "readOnly":false,
      "label":{
        "visible":true,
        "richText":false,
        "value":"def"
      },
      "properties": {
        "fd:dor":{
          "dorExclusion":false
        }
      },
      "events" : {
        "custom:setProperty" : ["$event.payload"]
      },
      ":type":"core/fd/components/form/textinput/v1/textinput"
    }
  ],
  "label":{
    "visible":true,
    "richText":false,
    "value":"dependent names"
  },
  "properties": {
    "afs:layout": {
      "tooltipVisible":false
    },
    "fd:dor": {
      "dorExclusion" : true,
      "dorExcludeTitle" : false,
      "dorExcludeDescription" : false,
      "breakBeforeText": "Following Previous",
      "breakAfterText": "Continue Filling Parent",
      "overflowText": "None",
      "dorNumCols": "3",
      "dorLayoutType": "columnar"
    }
  },
  "events" : {
    "custom:setProperty" : ["$event.payload"]
  },
  ":type":"core/fd/components/form/panelcontainer/v1/panelcontainer"
}