{
  "id": "image-7cfd7f1fe4",
  "fieldType": "image",
  "name": "emptyImage",
  "events": {
    "custom:setProperty": [
      "$event.payload"
    ]
  },
  "properties": {
    "fd:path": "/content/image",
    "fd:repoPath": "/content/dam/formsanddocuments/abc.jpeg",
    "fd:dor": {
      "dorExclusion": false
    },
    "customProp": "customPropValue"
  },
  ":type": "core/fd/components/form/image/v1/image"
}